{
 "label": "interface",
 "file": "petal-panic/assets/interface/select/none_sheet.png",
 "rows": 1,
 "cols": 1,
 "size": "1212x1297",
 "description": "No-character-selected HUD panel (single image)",
 "entities": [
  {
   "name": "select",
   "anim": "none",
   "frames": [
    {
     "file": "none_f1.png",
     "row": 0,
     "col": 0,
     "bbox": [
      0,
      0,
      1212,
      1297
     ]
    }
   ],
   "frames_dir": "petal-panic/assets/interface/select"
  }
 ],
 "crop": {
  "pass": "opaque-copy"
 },
 "kind": "tile_variant"
}
