{
 "label": "interface",
 "file": "petal-panic/assets/interface/home/bigtop_sheet.png",
 "rows": 1,
 "cols": 1,
 "size": "1536x1024",
 "description": "Bigtop tent interior home/parallax scene (single image)",
 "entities": [
  {
   "name": "home",
   "anim": "bigtop",
   "frames": [
    {
     "file": "bigtop_f1.png",
     "row": 0,
     "col": 0,
     "bbox": [
      0,
      0,
      1536,
      1024
     ]
    }
   ],
   "frames_dir": "petal-panic/assets/interface/home"
  }
 ],
 "crop": {
  "pass": "opaque-copy"
 },
 "kind": "tile_variant"
}
