{
 "label": "heroes",
 "file": "petal-panic/assets/heroes/scarlet_vale/crouch_sheet.png",
 "rows": 1,
 "cols": 8,
 "size": "2029x458",
 "description": "Scarlet Vale hero sheet 3, crouch x 8 frames",
 "entities": [
  {
   "name": "scarlet_vale",
   "anim": "crouch",
   "frames": [
    {
     "file": "crouch_f1.png",
     "row": 0,
     "col": 0,
     "bbox": [
      0,
      0,
      231,
      458
     ]
    },
    {
     "file": "crouch_f2.png",
     "row": 0,
     "col": 1,
     "bbox": [
      231,
      38,
      264,
      382
     ]
    },
    {
     "file": "crouch_f3.png",
     "row": 0,
     "col": 2,
     "bbox": [
      495,
      61,
      276,
      335
     ]
    },
    {
     "file": "crouch_f4.png",
     "row": 0,
     "col": 3,
     "bbox": [
      771,
      86,
      266,
      286
     ]
    },
    {
     "file": "crouch_f5.png",
     "row": 0,
     "col": 4,
     "bbox": [
      1037,
      85,
      259,
      287
     ]
    },
    {
     "file": "crouch_f6.png",
     "row": 0,
     "col": 5,
     "bbox": [
      1296,
      59,
      259,
      339
     ]
    },
    {
     "file": "crouch_f7.png",
     "row": 0,
     "col": 6,
     "bbox": [
      1555,
      38,
      249,
      382
     ]
    },
    {
     "file": "crouch_f8.png",
     "row": 0,
     "col": 7,
     "bbox": [
      1804,
      0,
      225,
      458
     ]
    }
   ],
   "frames_dir": "petal-panic/assets/heroes/scarlet_vale"
  }
 ],
 "crop": {
  "pass": "/tmp/redo-scarlet_vale-sheet3-v1"
 },
 "kind": "animation"
}
