{
 "label": "interface",
 "file": "petal-panic/assets/interface/squid_os_logo/idle_sheet.png",
 "rows": 1,
 "cols": 1,
 "size": "1757x582",
 "description": "Squid OS logo for credits splash (single image)",
 "entities": [
  {
   "name": "squid_os_logo",
   "anim": "idle",
   "frames": [
    {
     "file": "squid_os_logo_f1.png",
     "row": 0,
     "col": 0,
     "bbox": [
      0,
      0,
      1733,
      558
     ]
    }
   ],
   "frames_dir": "petal-panic/assets/interface/squid_os_logo"
  }
 ],
 "crop": {
  "pass": "/tmp/redo-single"
 },
 "kind": "tile_variant"
}
